title,state,year
"The Skill, Knowledge And Fashion University Bill, 2024",West Bengal,2024
"The West Bengal Scheduled Castes, Scheduled Tribes and other Backward Classes Development and Finance Corporation (Amendment) Bill, 2024",West Bengal,2024
"The Howrah Municipal Corporation (Amendment) Bill, 2024",West Bengal,2024
"The West Bengal Finance Bill, 2023",West Bengal,2026
"The West Bengal Land Laws (Repealing) Bill, 2023",West Bengal,2026
"The West Bengal Land Reforms (Amendment) Bill, 2023",West Bengal,2026
"The West Bengal Maintenance of Public Order (Amendment) Bill, 2023",West Bengal,2026
"The West Bengal Lokayukta (Amendment) Bill, 2023",West Bengal,2026
"The West Bengal Salaries and Allowances (Amendment) Bill, 2023",West Bengal,2026
"The West Bengal Labour Welfare Fund (Amendment) Bill, 2023",West Bengal,2026
"The West Bengal University Laws (Amendment) Bill, 2023",West Bengal,2026
"The West Bengal Goods and Services Tax (Amendment) Bill, 2023",West Bengal,2026
"The West Bengal Town and Country (Planning and Development) (Amendment) Bill, 2023",West Bengal,2026
"The West Bengal University Laws (Amendment) Bill, 2022",West Bengal,2026
"The West Bengal Krishi Viswa Vidyalaya Laws (Amendment) Bill, 2022",West Bengal,2026
"The West Bengal Cement Control (Repealing) Bill, 2022",West Bengal,2026
"The West Bengal Finance Bill, 2022",West Bengal,2026
"The Bengal Districts (Repealing) Bill, 2022",West Bengal,2026
"The Bengal Juvenile Smoking (Repealing) Bill, 2022",West Bengal,2026
"The Kolkata Municipal Corporation (Amendment) Bill, 2022",West Bengal,2026
"The West Bengal Municipal (Amendment) Bill, 2022",West Bengal,2026
"The Rajasthan Ayurved, Yoga and Naturopathy University, Ajmer Bill, 2026",Rajasthan,2026
"The Rajasthan Municipalities (Amendment) Bill, 2026",Rajasthan,2026
"The Rajasthan Panchayati Raj (Amendment) Bill, 2026",Rajasthan,2026
"The Rajasthan Prohibition of Transfer of Immovable Property and Provision for Protection of Tenants from Eviction from Premises in Disturbed Areas Bill, 2026",Rajasthan,2026
"The Rajasthan Shops and Commercial Establishments (Amendment) Bill, 2026",Rajasthan,2026
"The Rajasthan Jan Vishwas (Amendment of Provisions) Bill, 2026",Rajasthan,2026
"The Rajasthan Finance Bill, 2026",Rajasthan,2026
"The Bikaner Development Authority Bill, 2025",Rajasthan,2025
"The Bharatpur Development Authority Bill, 2025",Rajasthan,2025
"The Rajasthan Land Revenue (Amendment and Validation) Bill, 2025",Rajasthan,2025
"The Rajasthan Universities' Laws (Amendment) Bill, 2025",Rajasthan,2025
"The Rajasthan Finance Bill, 2025",Rajasthan,2025
"The Rajasthan Goods and Services Tax (Amendment) Bill, 2025",Rajasthan,2025
"The Rajasthan Prohibition of Unlawful Conversion of Religion Bill, 2025",Rajasthan,2025
"The Rajasthan Institute of Medical Sciences, Jaipur Bill, 2025",Rajasthan,2025
"The Fisheries (Amendment) Bill, 2025",Rajasthan,2025
"The Rajasthan Goods and Services Tax (Second Amendment) Bill, 2025",Rajasthan,2025
"The Factories (Rajasthan Amendment) Bill, 2025",Rajasthan,2025
"The Rajasthan University of Health Sciences (Amendment) Bill, 2025",Rajasthan,2025
"The Rajasthan Laws Repealing Bill, 2025",Rajasthan,2025
"The Rajasthan Coaching Centres (Control and Regulation) Bill, 2025",Rajasthan,2025
"The Rajasthan Laws (Amendment) Bill, 2025",Rajasthan,2025
"The Rajasthan Fighters of Democracy Honour Bill, 2024",Rajasthan,2024
"The Rajasthan Ground Water (Conservation and Management) Authority Bill, 2024",Rajasthan,2024
"The Gandhi Vatika Trust, Jaipur (Repeal) Bill, 2024",Rajasthan,2024
"The Rajasthan Finance Bill, 2024",Rajasthan,2024
"The Rajasthan Goods and Services Tax (Amendment) Bill, 2024",Rajasthan,2024
"The Rajasthan Prisons Bill, 2023",Rajasthan,2026
"The Rajiv Gandhi Fintech Digital Institute Bill, 2023",Rajasthan,2026
"The Mahatma Gandhi Institute of Governance and Social Sciences Bill, 2023",Rajasthan,2026
"The Jai Minesh Adivasi University, Ranpur (Kota) Bill, 2023",Rajasthan,2026
"The Rajasthan Micro, Small and Medium Enterprises (Facilitation of Establishment and Operation) (Amendment) Bill, 2023",Rajasthan,2026
"The Baba Amte Divyang University, Jaipur Bill, 2023",Rajasthan,2026
"The Nathdwara Temple (Amendment) Bill, 2023",Rajasthan,2026
"The Rajasthan Electricity (Duty) Bill, 2023",Rajasthan,2026
"The Mahatma Gandhi Divyang University, Jodhpur Bill, 2023",Rajasthan,2026
"The Rajasthan State Farmers Debt Relief Commission Bill, 2023",Rajasthan,2026
"The Rajasthan Tenancy (Amendment) Bill, 2023",Rajasthan,2026
"The Rajasthan Platform Based Gig Workers (Registration and Welfare) Bill, 2023",Rajasthan,2026
"The Rajasthan Finance Bill, 2023",Rajasthan,2026
"The Gandhi Vatika Trust, Jaipur Bill, 2023",Rajasthan,2026
"The Rajasthan Prevention of Anti-Social Activities (Amendment) Bill, 2023",Rajasthan,2026
"The Rajasthan University of Veterinary and Animal Sciences (Jobner) Jaipur Bill, 2023",Rajasthan,2026
"The Uttar Pradesh Shops and Commercial Establishments (Amendment) Bill, 2025",Uttar Pradesh,2025
"The King George's Medical University, Uttar Pradesh (Amendment) Bill, 2025",Uttar Pradesh,2025
"The Uttar Pradesh Facilitative Trade (Amendment of Provisions) Bill, 2025",Uttar Pradesh,2025
"The Uttar Pradesh Municipal Corporation (Amendment) Bill, 2025",Uttar Pradesh,2025
"The Uttar Pradesh Entitlement to Pension and Validation Bill, 2025",Uttar Pradesh,2025
"The Uttar Pradesh Education Service Selection Commission (Amendment) Bill, 2025",Uttar Pradesh,2025
"The Uttar Pradesh Sugarcane Cess (Repeal) Bill, 2025",Uttar Pradesh,2025
"The Uttar Pradesh Private Universities (Fifth Amendment) Bill, 2025",Uttar Pradesh,2025
"The Uttar Pradesh Private Universities (Fourth Amendment) Bill, 2025",Uttar Pradesh,2025
"The Uttar Pradesh Private Universities (Third Amendment) Bill, 2025",Uttar Pradesh,2025
"The Uttar Pradesh Rural Population Records Bill, 2025",Uttar Pradesh,2025
"The Uttar Pradesh State Legislature Members and Ministers Amenities Law (Amendment) Bill, 2025",Uttar Pradesh,2025
"The Uttar Pradesh Fiscal Responsibility and Budget Management (Amendment) Bill, 2025",Uttar Pradesh,2025
"The Uttar Pradesh State Public Service Commission (Regulation of Procedure) (Amendment) Bill, 2025",Uttar Pradesh,2025
"The Uttar Pradesh Shri Banke Bihari Ji Temple Trust Bill, 2025",Uttar Pradesh,2025
"The Uttar Pradesh Public Records Bill, 2025",Uttar Pradesh,2025
"The Uttar Pradesh Goods and Services Tax (Amendment) Bill, 2025",Uttar Pradesh,2025
"The Uttar Pradesh Motor Vehicle Taxation (Amendment) Bill, 2025",Uttar Pradesh,2025
"The Uttar Pradesh Private Universities (Amendment) Bill, 2025",Uttar Pradesh,2025
"The Uttar Pradesh Repeal Bill, 2025",Uttar Pradesh,2025
"The Uttar Pradesh Private Universities (Second Amendment) Bill, 2025",Uttar Pradesh,2025
"The Uttar Pradesh Town Planning and Development (Amendment) Bill, 2025",Uttar Pradesh,2025
"The Sanjay Gandhi Postgraduate Institute of Medical Sciences (Amendment) Bill, 2025",Uttar Pradesh,2025
"The Uttar Pradesh Gou-Seva Commission (Amendment) Bill, 2024",Uttar Pradesh,2024
"The Uttar Pradesh Private Universities (Sixth Amendment) Bill, 2024",Uttar Pradesh,2024
"The Uttar Pradesh Private Universities (Eighth Amendment) Bill, 2024",Uttar Pradesh,2024
"The Uttar Pradesh District Planning Committee (Amendment) Bill, 2024",Uttar Pradesh,2024
"The Madhya Pradesh Labour Welfare Fund (Amendment) Bill, 2026",Madhya Pradesh,2026
"The Registration (Madhya Pradesh Amendment) Bill, 2025",Madhya Pradesh,2025
"The Madhya Pradesh Goods and Services Tax (Amendment) Bill, 2025",Madhya Pradesh,2025
"The Indian Stamp (Madhya Pradesh Amendment) Bill, 2025",Madhya Pradesh,2025
"The Madhya Pradesh Universities (Amendment) Bill, 2025",Madhya Pradesh,2025
"The Madhya Pradesh Labor Laws (Amendment) and Miscellaneous Provisions Bill, 2025",Madhya Pradesh,2025
"The Madhya Pradesh Co-operative Societies (Amendment) Bill, 2025",Madhya Pradesh,2025
"The Madhya Pradesh Town and Village Investment (Amendment) Bill, 2025",Madhya Pradesh,2025
"The Madhya Pradesh Municipal (Amendment) Bill, 2025",Madhya Pradesh,2025
"The Madhya Pradesh Shops and Establishments (Second Amendment) Bill, 2025",Madhya Pradesh,2025
"The Madhya Pradesh Legal Aid and Legal Advice for Weaker Sections of Society (Repeal) Bill, 2025",Madhya Pradesh,2025
"The Madhya Pradesh Arbitration Tribunal (Amendment) Bill, 2025",Madhya Pradesh,2025
"The Madhya Pradesh Motor Vehicles Taxation (Amendment) Bill, 2025",Madhya Pradesh,2025
"The Madhya Pradesh Shops and Establishments (Amendment) Bill, 2025",Madhya Pradesh,2025
"The Factories (Madhya Pradesh Amendment) Bill, 2025",Madhya Pradesh,2025
"The Madhya Pradesh Public Trust (Amendment of Provisions) Bill, 2025",Madhya Pradesh,2025
"The Madhya Pradesh Metropolitan Region Planning and Development Bill, 2025",Madhya Pradesh,2025
"The Indian Stamp (Madhya Pradesh Second Amendment) Bill, 2025",Madhya Pradesh,2025
"The Madhya Pradesh Municipality (Amendment) Bill, 2024",Madhya Pradesh,2024
"The Madhya Pradesh University (Amendment) Bill, 2024",Madhya Pradesh,2024
"The Madhya Pradesh Goods and Services Tax (Amendment) Bill, 2024",Madhya Pradesh,2024
"The Madhya Pradesh Goods and Services Tax (Third Amendment) Bill, 2024",Madhya Pradesh,2024
"The Madhya Pradesh University Law (Amendment) Bill, 2024",Madhya Pradesh,2024
"The Madhya Pradesh Private Schools (Regulation of Fees and Related Matters) Amendment Bill, 2024",Madhya Pradesh,2024
"The Madhya Pradesh Jan Vishwas (Amendment of Provisions) Bill, 2024",Madhya Pradesh,2024
"The Madhya Pradesh Municipality (Second Amendment) Bill, 2024",Madhya Pradesh,2024
"The Madhya Pradesh Municipal Corporation (Amendment) Bill, 2024",Madhya Pradesh,2024
"The Madhya Pradesh Maa Sharda Devi Temple (Amendment) Bill, 2024",Madhya Pradesh,2024
"The Madhya Pradesh Legislative Assembly Leader of Opposition (Salary and Allowances) Amendment Bill, 2024",Madhya Pradesh,2024
"The Madhya Pradesh Legislative Assembly Speaker and Deputy Speaker (Salaries and Allowances) Amendment Bill, 2024",Madhya Pradesh,2024
"The Provincial Small Cause Courts (Repeal) Bill, 2024",Madhya Pradesh,2024
"The Madhya Pradesh Prevention and Safety Bill, 2024",Madhya Pradesh,2024
"The Madhya Pradesh Cow Slaughter Prohibition (Amendment) Bill, 2024",Madhya Pradesh,2024
"The Madhya Pradesh Private University (Establishment and Operation) Amendment Bill, 2024",Madhya Pradesh,2024
"The Madhya Pradesh Ministers (Salaries and Allowances) Amendment Bill, 2024",Madhya Pradesh,2024
"The Madhya Pradesh Correctional Services and Prisons Bill, 2024",Madhya Pradesh,2024
"The Madhya Pradesh University (Second Amendment) Bill, 2024",Madhya Pradesh,2024
"The Madhya Pradesh Local Authority (Election Offences) Amendment Bill, 2024",Madhya Pradesh,2024
"The Madhya Pradesh University of Medical Sciences (Amendment) Bill, 2024",Madhya Pradesh,2024
"The Madhya Pradesh Goods and Services Tax (Amendment) Bill, 2023",Madhya Pradesh,2026
"The Madhya Pradesh Profession Tax (Amendment) Bill, 2023",Madhya Pradesh,2026
"Cigarettes and Other Tobacco Products (Prohibition of Advertisement and Regulation of Trade and Commerce, Production, Supply and Distribution) Madhya Pradesh Amendment Bill, 2023",Madhya Pradesh,2026
"The Gwalior Trade Fair Authority (Amendment) Bill, 2023",Madhya Pradesh,2026
"The Madhya Pradesh Establishment and Operation of Industries Simplification Bill, 2023",Madhya Pradesh,2026
"The Bihar Private Professional Educational Institutions (Regulation of Admission and Determination of Fees) Bill, 2026",Bihar,2026
"The Bihar Micro Finance Institutions (Regulation of Money Lending and Prevention of Coercive Action) Bill, 2026",Bihar,2026
"The Bihar Secretariat Service (Amendment) Bill, 2026",Bihar,2026
"The Bihar Civil Court Bill, 2026",Bihar,2026
"The Bihar Municipal (Amendment) Bill, 2026",Bihar,2026
"The Bihar Staff Selection Commission (Amendment) Bill, 2026",Bihar,2026
"The Bihar Technical Service Commission (Amendment) Bill, 2026",Bihar,2026
"The Bihar Madrasa Board (Amendment) Bill, 2026",Bihar,2026
"The Bihar Jan Vishwas (Amendment of Provisions) Bill, 2026",Bihar,2026
"The Bihar Advocates Welfare Fund (Amendment) Bill, 2026",Bihar,2026
"The Bihar Underground Pipe Line (Acquisition of user's Right in Land) (Amendment) Bill, 2025",Bihar,2025
"The Bihar Agricultural Land (Conversion for Non-agricultural Purposes) (Amendment) Bill, 2025",Bihar,2025
"The Bihar Special Survey and Settlement (Amendment) Bill, 2025",Bihar,2025
"The Bihar Municipal (Amendment) Bill, 2025",Bihar,2025
"The Bihar Hindu Religious Trust (Amendment) Bill, 2025",Bihar,2025
"The Bihar Goods And Services Tax (First Amendment) Bill, 2025",Bihar,2025
"The Bihar Co-operative Societies (Amendment) Bill, 2025",Bihar,2025
"The Bihar Wood-Based Industries (Establishment and Regulation) Bill, 2025",Bihar,2025
"The Factories (Bihar Amendment) Bill, 2025",Bihar,2025
"The Bihar Shops and Establishments (Regulation of Employment and Conditions of Service) Bill, 2025",Bihar,2025
"The Bihar Platform Based Gig Workers (Registration, Safety and Welfare) Bill, 2025",Bihar,2025
"Jannayak Karpuri Thakur Skill University Bill, 2025",Bihar,2025
"The Bihar Animal Breeding Regulation Bill, 2025",Bihar,2025
"The Bihar Agricultural University (Amendment) Bill, 2025",Bihar,2025
"The Bihar Sanskrit Education Board (Amendment) Bill, 2024",Bihar,2024
"The Bihar State Child Labour Commission (Amendment) Bill, 2024",Bihar,2024
"The Bihar Value Added Tax (Amendment) Bill, 2024",Bihar,2024
"The Bihar Settlement of Taxation Disputes Bill, 2024",Bihar,2024
"The Bihar Public Safety (Measures) Enforcement Bill, 2024",Bihar,2024
"The Bihar Control of Crimes Bill, 2024",Bihar,2024
"The Bihar Technical Service Commission (Amendment) Bill, 2024",Bihar,2024
"The Bihar Sports University (Amendment) Bill, 2024",Bihar,2024
"The Bihar Government Premises (Allotment, Rent, Recovery and Eviction) (Amendment) Bill, 2024",Bihar,2024
"The Vesting of Bettiah Raj Properties Bill, 2024",Bihar,2024
"The Bihar Goods and Services Tax (Second Amendment) Bill, 2024",Bihar,2024
"The Bihar Lift and Escalators Bill, 2024",Bihar,2024
"The Bihar Goods and Services Tax (Amendment) Bill, 2024",Bihar,2024
"The Bihar Public Examinations (Prevention of Unfair Means) Bill, 2024",Bihar,2024
"The Bihar School Examination Board (Amendment) Bill, 2024",Bihar,2024
"The Bihar State University Service Commission (Amendment) Bill, 2024",Bihar,2024
"The Bihar Municipal (Amendment) Bill, 2024",Bihar,2024
"The Bihar State Women Commission (Amendment) Bill, 2024",Bihar,2024
"The Bihar State Minorities Commission (Amendment) Bill, 2024",Bihar,2024
"The Bihar State Madarsa Education Board (Amendment) Bill, 2024",Bihar,2024
"The Bihar Secretariat Service (Amendment) Bill, 2023",Bihar,2026
"The Bihar Goods and Services Tax (Amendment) Bill, 2023",Bihar,2026
"The Odisha Ministers' Salaries and Allowances (Amendment) Bill, 2025",Odisha,2025
"The Odisha Prevention of Land Encroachment (Amendment) Bill, 2025",Odisha,2025
"The Odisha Goods and Services Tax (Amendment) Bill, 2025",Odisha,2025
"The Odisha Universities (Amendment) Bill, 2025",Odisha,2025
"The Odisha Legislative Assembly Deputy Speakers Salary and Allowances (Amendment) Bill, 2025",Odisha,2025
"The Odisha Shops and Commercial Establishments (Amendment) Bill, 2025",Odisha,2025
"The Odisha Jan Vishwas Bill, 2025",Odisha,2025
"The Odisha Legislative Assembly Members Salary, Allowances and Pension (Amendment) Bill, 2025",Odisha,2025
"The Odisha Legislative Assembly Speakers Salary and Allowances (Amendment) Bill, 2025",Odisha,2025
"The Odisha Goods and Services Tax (Second Amendment) Bill, 2024",Odisha,2024
"The Odisha Public Examinations (Prevention of Unfair Means) Bill, 2024",Odisha,2024
"The Right to Fair Compensation and Transparency in Land Acquisition, Rehabilitation and Resettlement (Odisha Amendment) Bill, 2023",Odisha,2026
"The Odisha Apartment (Ownership and Management) Bill, 2023",Odisha,2026
"The Odisha Land Reforms (Second Amendment) Bill, 2023",Odisha,2026
"The Odisha Land Reforms (Amendment) Bill, 2023",Odisha,2026
"The Odisha State Commission for Backward Classes (Amendment) Bill, 2023",Odisha,2026
"The Odisha Consolidation of Holdings and Prevention of Fragmentation of Land (Amendment) Bill, 2023",Odisha,2026
"The Odisha Pani Panchayat (Amendment) Bill, 2023",Odisha,2026
"The Silicon University, Odisha Bill, 2023",Odisha,2026
"The Odisha Municipal Laws (Amendment) Bill, 2023",Odisha,2026
"The NIST University, Odisha Bill, 2023",Odisha,2026
"The Odisha Goods and Services Tax (Amendment) Bill, 2023",Odisha,2026
"The Odisha Reservation of Vacancies in Posts and Services (For Scheduled Castes and Scheduled Tribes)(Amendment) Bill, 2023",Odisha,2026
"The Odisha District Planning Committees (Amendment) Bill, 2022",Odisha,2026
"The Odisha Fiscal Responsibility and Budget Management (Amendment) Bill, 2022",Odisha,2026
"The DRIEMS University, Odisha Bill, 2022",Odisha,2026
"Shri Jagannath Temple (Amendment) Bill, 2022",Odisha,2026
"The Odisha Panchayat Laws (Amendment) Bill, 2022",Odisha,2026
"The Odisha Municipal Laws (Amendment) Bill, 2022",Odisha,2026
"The Odisha Municipal Corporation (Amendment) Bill, 2022",Odisha,2026
"The Gandhi Institute of Engineering and Technology University, Odisha (Amendment) Bill, 2022",Odisha,2026
"The C.V. Raman Global University, Odisha (Amendment) Bill, 2022",Odisha,2026
"The Odisha Lokayukta (Amendment) Bill, 2022",Odisha,2026
"The Odisha Fire Service (Amendment) Bill, 2022",Odisha,2026
"The Odisha Goods and Services Tax (Amendment) Bill, 2022",Odisha,2026
"The Telangana Panchayat Raj (Second Amendment) Bill, 2026",Telangana,2026
"The Telangana Panchayat Raj (Amendment) Bill, 2026",Telangana,2026
"The Telangana (Regulation of Appointments to Public Services and Rationalization of Staff Pattern and Pay Structure) (Second Amendment) Bill, 2026",Telangana,2026
"The Telangana (Regulation of Appointments to Public Services and Rationalization of Staff Pattern and Pay Structure) (Amendment) Bill, 2026",Telangana,2026
"The Telangana Motor Vehicles Taxation (Amendment) Bill, 2026",Telangana,2026
"The Telangana Private Universities (Establishment and Regulation) (Amendment) Bill, 2026",Telangana,2026
"The Greater Hyderabad Municipal Corporation (Second Amendment) Bill, 2026",Telangana,2026
"The Greater Hyderabad Municipal Corporation (Amendment) Bill, 2026",Telangana,2026
"The Telangana Municipalities (Third Amendment) Bill, 2026",Telangana,2026
"The Telangana Municipalities (Second Amendment) Bill, 2026",Telangana,2026
"The Telangana Goods and Services Tax (Amendment) Bill, 2026",Telangana,2026
"The Telangana Universities (Amendment) Bill, 2026",Telangana,2026
"The Telangana Municipalities (Fourth Amendment) Bill, 2026",Telangana,2026
"The Telangana Panchayat Raj (Amendment) Bill, 2025",Telangana,2025
"The Telangana Municipalities (Amendment) Bill, 2025",Telangana,2025
"The Telangana Advocates Clerks Welfare Fund (Amendment) Bill, 2025",Telangana,2025
"The Telangana Advocates Welfare Fund (Amendment) Bill, 2025",Telangana,2025
"The Telangana Charitable and Hindu Religious Institutions and Endowments (Amendment) Bill, 2025",Telangana,2025
"The Telangana Backward Classes (Reservation of Seats In Rural and Urban Local Bodies) Bill, 2025",Telangana,2025
"The Telangana Backward Classes, Scheduled Castes and Scheduled Tribes (Reservation of Seats In Educational Institutions and of Appointments or Posts In The Services Under The State) Bill, 2025",Telangana,2025
"The Telangana Scheduled Castes (Rationalisation of Reservations) Bill, 2025",Telangana,2025
"The Telangana Panchayat Raj (Second Amendment) Bill, 2025",Telangana,2025
"The Telangana Municipalities (Second Amendment) Bill, 2025",Telangana,2025
"The Telangana Allopathic Private Medical Care Establishments (Registration and Regulation) (Repeal) Bill, 2025",Telangana,2025
"The Telangana Panchayat Raj (Third Amendment) Bill, 2025",Telangana,2025
"The Telangana Municipalities (Third Amendment) Bill, 2025",Telangana,2025
"The Telangana Transplantation of Human Organs (Repeal) Bill, 2025",Telangana,2025
"The Potti Sreeramulu Telugu University (Amendment) Bill, 2025",Telangana,2025
"The Draft Telangana Gig and Platform Workers (Registration, Social Security, and Welfare) Bill, 2025",Telangana,2025
"The Young India Physical Education and Sports University of Telangana Bill, 2024",Telangana,2024
"The Telangana (Regulation of Appointments to Public Services and Rationalisation of Staff Pattern and Pay Structure (Amendment) Bill, 2024",Telangana,2024
"The Telangana Laws (Change of Acronyms) Bill, 2024",Telangana,2024
"The Telangana Civil Courts (Amendment) Bill, 2024",Telangana,2024
"The Young India Skills University (Public-Private Partnership) Bill, 2024",Telangana,2024
"The Telangana Panchayat Raj (Amendment) Bill, 2024",Telangana,2024
"The Andhra Pradesh Farmers Management of Irrigation Systems (Amendment) Bill, 2026",Andhra Pradesh,2026
"The Andhra Pradesh Prisons and Correctional Services Bill, 2026",Andhra Pradesh,2026
"Sri Venkateswara Vedic University (Amendment) Bill, 2026",Andhra Pradesh,2026
"The Andhra Pradesh Charitable and Hindu Religious Institutions and Endowments (Amendment) Bill, 2026",Andhra Pradesh,2026
"The Andhra Pradesh Allopathic Private Medical Care and Establishments (Registration and Regulation) (Amendment) Bill, 2026",Andhra Pradesh,2026
"The Andhra Pradesh Panchayat Raj (Amendment) Bill, 2026",Andhra Pradesh,2026
"The Andhra Pradesh Electricity Duty (Amendment) Bill, 2026",Andhra Pradesh,2026
"The Andhra Pradesh Municipal Laws (Second Amendment) Bill, 2026",Andhra Pradesh,2026
"The Andhra Pradesh Value Added Tax (Amendment) Bill, 2026",Andhra Pradesh,2026
"The Jawaharlal Nehru Technological Universities (Amendment) Bill, 2026",Andhra Pradesh,2026
"The Andhra Pradesh Motor Vehicles Taxation (Amendment) Bill, 2026",Andhra Pradesh,2026
"The Andhra Pradesh Jan Vishwas (Amendment of Provisions) Bill, 2026",Andhra Pradesh,2026
"The Andhra Pradesh Fire Service (Amendment) Bill, 2026",Andhra Pradesh,2026
"The Andhra Pradesh Grama Sachivalayams and Ward Sachivalayams (GSWS) (Amendment) Bill, 2026",Andhra Pradesh,2026
"The Andhra Pradesh Assigned Lands (Prohibition of Transfers) (Amendment) Bill, 2026",Andhra Pradesh,2026
"The Andhra Pradesh Municipal Laws (Amendment) Bill, 2026",Andhra Pradesh,2026
"The Andhra Pradesh Private Universities (Establishment and Regulation) (Second Amendment) Bill, 2025",Andhra Pradesh,2025
"The Andhra Pradesh State Teachers Transfers Regulation Bill, 2025",Andhra Pradesh,2025
"The Andhra Pradesh Private Universities (Establishment and Regulation) (Amendment) Bill, 2025",Andhra Pradesh,2025
"The Andhra Pradesh Metropolitan Region and Urban Development Authorities (Amendment) Bill, 2025",Andhra Pradesh,2025
"The Andhra Pradesh Goods and Services Tax (Amendment) Bill, 2025",Andhra Pradesh,2025
"The Andhra Pradesh (Regulation of Appointments to Public Services and Rationalisation of Staff Pattern and Pay Structure) (Amendment) Bill, 2025",Andhra Pradesh,2025
"The Andhra Pradesh (Andhra Area) Ayurvedic and Homeopathic Medical Practitioners Registration (Amendment) Bill, 2025",Andhra Pradesh,2025
"The Andhra Pradesh Agricultural Land (Conversion for Non Agricultural Purposes) (Repeal) Bill, 2025",Andhra Pradesh,2025
"The Andhra Pradesh Universities (Amendment) Bill, 2025",Andhra Pradesh,2025
"The Andhra Pradesh Private Universities (Establishment and Regulation) (Third Amendment) Bill, 2025",Andhra Pradesh,2025
"The India International University of Legal Education and Research of the Bar Council of India Trust at Andhra Pradesh Bill, 2025",Andhra Pradesh,2025
"The Andhra Pradesh Municipalities (Amendment) Bill, 2025",Andhra Pradesh,2025
"The Andhra Pradesh Municipal Laws (Fourth Amendment) Bill, 2025",Andhra Pradesh,2025
"The Andhra Pradesh Municipal Laws (Third Amendment) Bill, 2025",Andhra Pradesh,2025
"The Andhra Pradesh Municipal Laws (Second Amendment) Bill, 2025",Andhra Pradesh,2025
"The Andhra Pradesh Municipal Laws (Amendment) Bill, 2025",Andhra Pradesh,2025
"The Andhra Pradesh State Aquaculture Development Authority (Amendment) Bill, 2025",Andhra Pradesh,2025
"The Andhra Pradesh Rights in Land and Pattadar Pass Books (Amendment) Bill, 2025",Andhra Pradesh,2025
"The Andhra Pradesh Grama Sachivalayams and Ward Sachivalayams (GSWS) (Amendment) Bill, 2025",Andhra Pradesh,2025
"The Bharatiya Nagarik Suraksha Sanhita (Andhra Pradesh Amendment) Bill, 2025",Andhra Pradesh,2025
"The Andhra Pradesh Panchayat Raj (Amendment) Bill, 2025",Andhra Pradesh,2025
"The Andhra Pradesh Scheduled Castes (Sub-Classification) Bill, 2025",Andhra Pradesh,2025
"The Andhra Pradesh Excise (Amendment) Bill, 2025",Andhra Pradesh,2025
"The Factories (Andhra Pradesh Amendment) Bill, 2025",Andhra Pradesh,2025
"The Andhra Pradesh Prevention of Begging (Amendment) Bill, 2025",Andhra Pradesh,2025
"The Andhra Pradesh State Commission for Scheduled Tribes (Amendment) Bill, 2025",Andhra Pradesh,2025
"The Andhra Pradesh Shops and Establishments (Amendment) Bill, 2025",Andhra Pradesh,2025
"The Andhra Pradesh Motor Vehicles Taxation (Amendment) Bill, 2025",Andhra Pradesh,2025
"The Haryana Consolidation of Project Land (Special Provisions) Amendment Bill, 2026",Haryana,2026
"The Haryana Development and Regulation of Urban Areas (Amendment) Bill, 2026",Haryana,2026
"The Haryana Fiscal Responsibility and Budget Management (Amendment) Bill, 2026",Haryana,2026
"The Haryana Police (Amendment) Bill, 2026",Haryana,2026
"The Haryana Registration and Regulation of Travel Agents (Amendment) Bill, 2026",Haryana,2026
"The Haryana Extension Lecturers and Guest Lecturers (Security of Service) Amendment Bill, 2026",Haryana,2026
"The Haryana Honorable Disposal of Dead Body Bill, 2025",Haryana,2025
"The Insecticides (Haryana Amendment) Bill, 2025",Haryana,2025
"The Seeds (Haryana Amendment) Bill, 2025",Haryana,2025
