title,state,year
"The Haryana Land Revenue (Amendment) Bill, 2025",Haryana,2025
"The Haryana Panchayati Raj (Amendment) Bill, 2025",Haryana,2025
"The Haryana Scheduled Roads and Controlled Areas Restriction of Unregulated Development (Amendment) Bill, 2025",Haryana,2025
"The Haryana Shops and Commercial Establishment (Amendment) Bill, 2025",Haryana,2025
"The Haryana Abadi Deh (Vesting, Recording and Resolving of Ownership Rights) Bill, 2025",Haryana,2025
"The Haryana Private Universities (Amendment) Bill, 2025",Haryana,2025
"The Haryana Jan Vishwas (Amendment of Provisions) Bill, 2025",Haryana,2025
"The Haryana Housing Board (Amendment) Bill, 2025",Haryana,2025
"The Haryana Technical Education Guest Faculty (Security of Service) Amendment Bill, 2025",Haryana,2025
"The Haryana Panchayati Raj (Second Amendment) Bill, 2025",Haryana,2025
"The Haryana Municipal Corporation (Amendment) Bill, 2025",Haryana,2025
"The Haryana Shri Haryana Shri Kapal Mochan, Shri Badri Narain, Shri Mantra Devi and Shri Kedar Nath Shrine (Amendment) Bill, 2025",Haryana,2025
"The Haryana Antrarashtriya Gita Jyanti Mela Authority (Amendment) Bill, 2025",Haryana,2025
"The Sports University of Haryana (Amendment) Bill, 2025",Haryana,2025
"The Haryana Shri Mata Bhimeshwari Devi Mandir (Ashram), Beri Shrine (Amendment) Bill, 2025",Haryana,2025
"The Haryana Shri Mata Sheetla Devi Shrine (Amendment) Bill, 2025",Haryana,2025
"The Haryana Shri Mata Mansa Devi Shrine (Amendment) Bill, 2025",Haryana,2025
"The Haryana Municipal Bill, 2025",Haryana,2025
"The Haryana Municipal Bodies Bill, 2025",Haryana,2025
"The Haryana Legislative Assembly (Facilities to Members) Second Amendment Bill, 2025",Haryana,2025
"The Haryana Management of Civic Amenities and Infrastructure Deficient Municipal Areas (Special Provisions) Amendment Bill, 2025",Haryana,2025
"The Haryana Management of Civic Amenities and Infrastructure Deficient Areas Outside Municipal Area (Special Provisions) Amendment Bill, 2025",Haryana,2025
"The Haryana Goods and Services Tax (Amendment) Bill, 2025",Haryana,2025
"The Haryana Backward Classes Commission (Amendment) Bill, 2025",Haryana,2025
"The Panchkula Metropolitan Development Authority (Amendment) Bill, 2025",Haryana,2025
"The Haryana Legislative Assembly (Salary, Allowances and Pension of Members) Amendment Bill, 2025",Haryana,2025
"The Haryana Legislative Assembly (Facilities to Members) Amendment Bill, 2025",Haryana,2025
"The Haryana Legislative Assembly (Medical Facilities to Members) Amendment Bill, 2025",Haryana,2025
"The Haryana (Exchange of Prisoners) Repeal Bill, 2025",Haryana,2025
"The Aparna Institution (Taking over of Management and Control) Bill, 2025",Haryana,2025
"The Haryana Horticulture Nurseries Bill, 2025",Haryana,2025
"The Haryana Contractual Employees (Security of Service) Amendment Bill, 2025",Haryana,2025
"The Haryana Prevention of Public Gambling Bill, 2025",Haryana,2025
"The Haryana Registration and Regulation of Travel Agents Bill, 2025",Haryana,2025
"The Societies Registration (Delhi Amendment) Bill, 2026",Delhi,2026
"The Delhi Shops and Establishments (Amendment) Bill, 2026",Delhi,2026
"The Delhi Jan Vishwas (Amendment of Provisions) Bill, 2026",Delhi,2026
"The Court Fees (Delhi Amendment) Bill, 2026",Delhi,2026
"The Delhi Goods and Services Tax (Second Amendment) Bill, 2025",Delhi,2025
"The Delhi Goods and Services Tax (Amendment) Bill, 2025",Delhi,2025
"The Delhi School Education (Transparency in Fixation and Regulation of Fees) Bill, 2025",Delhi,2025
"The Delhi Goods & Services Tax (Third Amendment) Bill, 2024",Delhi,2024
"The Delhi Goods and Services Tax (Second Amendment) Bill, 2023",Delhi,2026
"The Delhi Goods and Services Tax (Amendment) Bill, 2023",Delhi,2026
"The Salary and Allowances of the Chief Whip in the Legislative Assembly of the National Capital Territory of Delhi (Amendment) Bill, 2022",Delhi,2026
"The Members of Legislative Assembly of the National Capital Territory of Delhi (Salaries, Allowances, Pension etc.) (Amendment) Bill, 2022",Delhi,2026
"The Ministers of the Government of National Capital Territory of Delhi (Salaries and Allowances) (Amendment) Bill, 2022",Delhi,2026
"The Goa Provision of Water Supply (Amendment) Bill, 2022",Delhi,2026
"The Delhi Electricity Reforms (Amendment) Bill, 2022",Delhi,2026
"The Delhi Teachers University Bill, 2022",Delhi,2026
"The Leader of Opposition in the Legislative Assembly of the National Capital Territory of Delhi (Salaries and Allowances) (Amendment) Bill, 2022",Delhi,2026
"The Speaker and Deputy Speaker of the Legislative Assembly of National Capital Territory of Delhi (Salaries and Allowances) (Amendment) Bill, 2022",Delhi,2026
"The Delhi Sikh Gurdwaras (Amendment) Bill, 2022",Delhi,2026
"The NCT of Delhi (Incredible India) Bed and Breakfast Establishments (Registration & Regulation) (Amendment) Bill, 2021",Delhi,2026
"The Delhi Goods and Services Tax (Amendment) Bill, 2021",Delhi,2026
"The Delhi Goods and Services Tax (Amendment) Bill, 2020",Delhi,2026
"The Delhi Goods and Services Tax (Amendment) Bill, 2019",Delhi,2026
"The Delhi Sports University Bill, 2019",Delhi,2026
"The Delhi Skills and Entrepreneurship University Bill, 2019",Delhi,2026
"The Contingency Fund of the NCT of Delhi (Amendment) Bill, 2018",Delhi,2026
"The Delhi Goods & Services Tax (Amendment) Bill, 2018",Delhi,2026
"The Regularisation of Services of Guest Teachers and Teachers Engaged Under The 'Sarva Shiksha Abhiyan' Bill, 2017",Delhi,2026
"The Delhi (Right of Citizen to Time Bound Delivery of Services) Amendment Bill, 2017",Delhi,2026
"The Minimum Wages (Delhi) Amendment Bill, 2017",Delhi,2026
"The Delhi Netaji Subhas University of Technology Bill, 2017",Delhi,2026
"The Delhi Goods and Services Tax (GST) Bill, 2017",Delhi,2026
"The Delhi Tax on Luxuries (Amendment) Bill, 2016",Delhi,2026
"The Delhi School (Verification of Accounts and Refund of Excess Fee) Bill, 2015",Delhi,2026
"The Delhi Value Added Tax (2nd Amendment) Bill, 2015",Delhi,2026
"The Delhi Members of Legislative Assembly (Removal of Disqualification) (Amendment) Bill, 2015",Delhi,2026
"The Delhi Netaji Subhas University of Technology Bill, 2015",Delhi,2026
The Delhi Urban Shelter Improvement Board (Amendment) Act 2015,Delhi,2026
"The Delhi Value Added Tax (1st Amendment) Bill, 2015",Delhi,2026
"The Delhi Value Added Tax (3rd Amendment) Bill, 2015",Delhi,2026
"The Salary and Allowances of the Chief Whip in the Legislative Assembly of the National Capital Territory of Delhi (Amendment) Bill, 2015",Delhi,2026
"The Leader of Opposition in the Legislative Assembly of the National Capital Territory of Delhi (Salaries and Allowances) (Amendment) Bill, 2015",Delhi,2026
"The Speaker and Deputy Speaker of the Legislative Assembly of National Capital Territory of Delhi (Salaries and Allowances) (Amendment) Bill, 2015",Delhi,2026
"The Ministers of The National Capital Territory of Delhi (Salaries and Allowances) (Amendment) Bill, 2015",Delhi,2026
"The Members of Legislative Assembly of National Capital Territory of Delhi (Salaries, Allowances, Pension, etc.) (Amendment) Bill, 2015",Delhi,2026
"The Delhi Jan Lokpal Bill, 2015",Delhi,2026
